{"schema_version":"1.0","receipt_id":"LS-RESTORE-RECEIPT-FIXTURE-COMMITTED","request_id":"LS-RESTORE-REQ-FIXTURE-001","operation_id":"RESTORE-OP-FIXTURE-001","idempotency_key":"FIXTURE-RESTORE-IDEMPOTENCY-0001","sku_id":"SKU-FIXTURE-001","result":"RESTORE_COMMITTED","current_before":{"passport_id":"PSP-FIXTURE-002","passport_lineage_id":"LINEAGE-FIXTURE-001","version":"3","path":"C:/product/SKU-FIXTURE-001/archive/PSP-FIXTURE-002-v3/passport.json","sha256":"2222222222222222222222222222222222222222222222222222222222222222","lifecycle_status":"ARCHIVED"},"archived_source":{"passport_id":"PSP-FIXTURE-001","passport_lineage_id":"LINEAGE-FIXTURE-001","version":"7","path":"C:/product/SKU-FIXTURE-001/archive/PSP-FIXTURE-001-v7/passport.json","sha256":"aaaaaaaaaaaaaaaaaaaaaaaaaaaaaaaaaaaaaaaaaaaaaaaaaaaaaaaaaaaaaaaa","lifecycle_status":"ARCHIVED"},"restored_new_passport":{"passport_id":"PSP-FIXTURE-003","passport_lineage_id":"LINEAGE-FIXTURE-001","version":"1","path":"C:/product/SKU-FIXTURE-001/passport.json","sha256":"4444444444444444444444444444444444444444444444444444444444444444","lifecycle_status":"ACTIVE"},"current_after":{"passport_id":"PSP-FIXTURE-003","passport_lineage_id":"LINEAGE-FIXTURE-001","version":"1","path":"C:/product/SKU-FIXTURE-001/passport.json","sha256":"4444444444444444444444444444444444444444444444444444444444444444","lifecycle_status":"ACTIVE"},"replaced_current_archive_receipt":{"ref":"PSP-ARCHIVE-FIXTURE-CURRENT-002","sha256":"5555555555555555555555555555555555555555555555555555555555555555"},"canonical_pointer_count":1,"downstream_invalidation_status":"STALE_BINDINGS_RECORDED","rollback_status":"NOT_REQUIRED","publication_authority":"NOT_GRANTED","committed_at":"2026-10-04T14:05:00Z"}
