{"schema_version":"1.0","receipt_id":"LS-RESTORE-RECEIPT-FIXTURE-ROLLBACK","request_id":"LS-RESTORE-REQ-FIXTURE-002","operation_id":"RESTORE-OP-FIXTURE-002","idempotency_key":"FIXTURE-RESTORE-ROLLBACK-0001","sku_id":"SKU-FIXTURE-001","result":"RESTORE_ROLLED_BACK","current_before":{"passport_id":"PSP-FIXTURE-002","passport_lineage_id":"LINEAGE-FIXTURE-001","version":"3","path":"C:/product/SKU-FIXTURE-001/passport.json","sha256":"2222222222222222222222222222222222222222222222222222222222222222","lifecycle_status":"ACTIVE"},"archived_source":{"passport_id":"PSP-FIXTURE-001","passport_lineage_id":"LINEAGE-FIXTURE-001","version":"7","path":"C:/product/SKU-FIXTURE-001/archive/PSP-FIXTURE-001-v7/passport.json","sha256":"aaaaaaaaaaaaaaaaaaaaaaaaaaaaaaaaaaaaaaaaaaaaaaaaaaaaaaaaaaaaaaaa","lifecycle_status":"ARCHIVED"},"restored_new_passport":null,"current_after":{"passport_id":"PSP-FIXTURE-002","passport_lineage_id":"LINEAGE-FIXTURE-001","version":"3","path":"C:/product/SKU-FIXTURE-001/passport.json","sha256":"2222222222222222222222222222222222222222222222222222222222222222","lifecycle_status":"ACTIVE"},"replaced_current_archive_receipt":null,"canonical_pointer_count":1,"downstream_invalidation_status":"NOT_STARTED","rollback_status":"COMPLETED","publication_authority":"NOT_GRANTED","committed_at":null}
